id;title;text;date
1;Найти работу;Составить резюме, отправить в компании по списку;13-03-2023 18:49:32
2;Купить продукты;масло, сыр, колбаса, бананы, яйца;13-03-2023 18:59:24
3;Взять в отпуск;Купальник, одежда, предметы гигиены, деньги;13-03-2023 19:00:47
4;Планы на вечер ;Забрать детей из школы, приготовить ужин, сделать д/з;13-03-2023 19:02:38
5;Позвать на ДР;Маша, Петя, Катя, Ваня;13-03-2023 19:08:21
6;Состав винигрета;свекла, картофель, морковь, соленые огурцы, зеленый горошек, лук;13-03-2023 23:59:02
7;Утренняя зарядка;Приседания, отжимания, повороты в стороны;14-03-2023 10:34:17
